,created_at,location,text
1,5/10/2019 14:42,"Seattle, WA","I always worry that Google is actively harming its, say, @googlecloud adoption with all these shutdowns. I wonder how many users know/trust which Cloud/etc products are ""GA"" (promise to not shut down for N years). Maybe ton of brands is the answer? https://t.co/0pchmsOr0z"
2,5/4/2019 17:29,"Seattle, WA",@raggi @googlecloud Basically. Useful for quick prototyping iteration time at least.
3,5/4/2019 17:25,"Seattle, WA","Immediate code deploys on @googlecloud #CloudRun/GCF with this one weird trick...
Deploy your new code as a CGI binary, upload to Cloud Storage.
Make actual func/container be CGI host that downloads (cache/if needed) CGI subprocess from URL in header.
#golang net/http/cgi FTW? <U+0001F61C>"
4,5/10/2019 15:47,"Seattle, WA","@__agwa @googlecloud I actually didn't know what N was myself, clearly. :-/"
5,5/10/2019 23:14,"Seattle, WA",@b6n @googlecloud But think how many more there will be in two years!
6,5/10/2019 12:29,,"@YepLance No, you can use Google Cloud pretty much right away. The verification typically doesn't take long and the time reimbursement can vary depending on your bank but wont be more than 24 hours. You can absolutely proceed with using the platform. -CA"
7,5/2/2019 17:01,,"@guddukhan1987 Hi Guddu, you may find the progress summary in the link in our previous Tweet. Feel free to reach out if you have questions. Cheers! -EC"
8,5/11/2019 7:18,,"@AaronGreenspan Hi Aaron, IAM is the abbreviation of Identity &amp; Access Management. You'll find more information in this link https://t.co/GUaO20UP2R. Regarding your other doubts, as it was mentioned, we recommend you to discuss them in our Community F"
9,5/3/2019 22:53,,"@rylz Hey Riley, if this isn't in our Issue Tracker, I recommend reviewing it with our Community Support https://t.co/Oj5hWJOeL5. - KT"
10,5/2/2019 15:22,,@fknfancy The status dashboard has now been updated to reflect this issue. You can check here for updates https://t.co/8a7lnMRMvI We're sorry for any inconvenience this may cause. -LH
11,5/10/2019 12:02,,@YepLance This one dollar charge is validation of a genuine user. It's just a security measure to verify your account exists. Once the validation is done the charge is reimbursed. Many sites online that register a card does this. -CA
12,5/4/2019 18:00,,"@PaulDMendoza Hi there, sorry to hear about this. Can you DM me a case number or forum post link so I can follow up with the Support Team? - KT"
13,5/6/2019 1:10,,"""Most cloud vendors directed us to their SLAs and left it at that, but Google's networking team jumped at the chance to explore new approaches. Working together, we cut response times by 20% to 40%."" —Elad Amit, Director of Platform Development, PerimeterX https://t.co/xfrlBugdPV https://t.co/RUfp8xwjak"
14,5/11/2019 20:04,,Our #ML control system for data center cooling has resulted in a 30% better plant efficiency than human-managed controls. Learn more about the software systems that power this technology in this Cloud OnAir session <U+2192> https://t.co/hVF8lrBBTk https://t.co/ce76wdc5SV
15,5/11/2019 7:05,,"@AaronGreenspan Hi Aaron, sorry to hear that. Have you discussed this in our Community forums (https://t.co/rfqNAoaNkP)? If so, please DM us the link to your post. We also recommend you to contact our Billing Support Team (https://t.co/oajEnheXBf) and the"
16,5/11/2019 3:11,,Here's what we mapped out for @GMapsPlatform from #io19 <U+2192> https://t.co/0WUoTC5NgB https://t.co/2k1F5TWKUu
17,5/8/2019 20:05,,"Hear from Timo Salzsieder, METRO CIO/CSO, on METRO's journey with SAP on Google Cloud. Learn how @SAP on @GCPcloud helps METRO lower costs, increase efficiency, and improve customer experience with #ML <U+2192> https://t.co/V0RvUkPqAS #SAPPHIRENOW https://t.co/4iSupm3qWA"
18,5/9/2019 19:05,,"@JoeBlubaugh @googledevs Hi Joe, sorry to hear about your experience. If you have a suggestion for product improvement, feel free to submit a feature request here: https://t.co/vfB8vIylDx. -EC"
19,5/7/2019 21:17,,"A sustainable future demands that we create change in the present. Learn more about founder of Topolytics and #Circular2030 grand prize winner, Michael Grove's idea that does just that <U+2192> https://t.co/xbSDzgk50b https://t.co/GXvTZxA11q"
20,5/8/2019 16:37,,Use @Apigee to create &amp; manage APIs for other developers who use your software. Get hands-on experience by enrolling in “App Modernization with Apigee” today <U+2192> https://t.co/Hg46yO7vWf https://t.co/y7oSDp4tKI
21,5/3/2019 21:26,,@kowlgi We've flagged this to our Community Support Team and they'll take a look. -LC
22,5/4/2019 17:42,,"@PaulDMendoza Hey Paul, have you discussed this with Community Support? If so, send me the link to your discussion https://t.co/Oj5hWJOeL5. - KT"
23,5/7/2019 1:09,,"250+ entries. 50 countries. 1 grand prize winner. 

Tune in tomorrow to find out which idea advances a circular economy and won our social entrepreneurship contest, #Circular2030 <U+2192> https://t.co/AruwZqj1UD https://t.co/osUrElrEgA"
24,5/2/2019 15:31,,"@BAESlZE Hey there, sorry that you're having some issues with Compute Engine right now. We are aware of an issue that is affecting some users, and you can keep up to date with this here: https://t.co/8a7lnMRMvI. -GW"
25,5/2/2019 15:20,,@bergehurra Our GCP Status dashboard has been updated with information of the outage. You can view updates here https://t.co/8a7lnMRMvI We're sorry for any inconvenience this may cause. -LH
26,5/2/2019 23:17,,"Does data access, security, governance, and regulatory compliance make you pause on moving your data to the cloud? Here are some best practices and guidelines that will help you hit play to establishing data governance in a cloud-first world <U+2192> https://t.co/7psLM7rafc https://t.co/B7vXlXvXfH"
27,5/8/2019 10:23,,@mathewpregasen It's possible that this is a misunderstanding. We recommend getting in touch with our billing team to investigate this https://t.co/5J1bHQWaU6 -LH
28,5/2/2019 19:33,,From the data warehouse: Hear from @uhoelzle and @qhardy as they talk about how #ML simplifies problem-solving for businesses <U+2192> https://t.co/1rQJWkn2TJ https://t.co/8iVHwlSRPa
29,5/4/2019 1:07,,"Sun, Wind, and the Cloud: Learn how we source 100% clean energy for Google data centers in this on demand, Cloud OnAir session <U+2192> https://t.co/RdHBfNvIJs https://t.co/vgMb2iJPe0"
30,5/8/2019 6:15,,"@staticillmatic Thanks for the reply. Since you tweeted Google Express today, we'd recommend waiting 24 hours for a follow up by the Google Express team. If you haven't heard a reply from the team in that time, please feel free to message us again and we'"
31,5/2/2019 15:48,,"@ilikedata Hi Tai, I'm sorry to hear that, but thanks for letting us know! You can keep up to date on the status dashboard here: https://t.co/8a7lnMRMvI -GW"
32,5/8/2019 6:01,,@staticillmatic Hmm... have you tried tweeting or DMing @googleexpress? Keep us posted with how you get on we want to make sure that you're supported. -CW
33,5/7/2019 15:31,,"From providing global virtualized compute infrastructure to offering fully-managed services, learn more about our partnership with @SAP and how we’re ensuring Google Cloud is the best place to run SAP workloads <U+2192> https://t.co/NLC7cycR8h https://t.co/XaENysLvsF"
34,5/11/2019 4:38,,"@blobdell Hi Bryce, we're glad to hear the problem seems to be fixed. If you have another issue in the future, you can check our GCP Status Dashboard (https://t.co/9vj6bHIODk) to know more about the status of our services. Feel free to message us back if "
35,5/10/2019 16:07,,"By leveraging Google Cloud, @SunPower helps homeowners create their own design in seconds, and:
<U+2714><U+FE0F> improves their buying experience
<U+2714><U+FE0F> reduces barriers to going solar
<U+2714><U+FE0F> increases solar adoption on a larger scale
Learn more <U+2192> https://t.co/Gs7W780cjV https://t.co/I7UF46GSJR"
36,5/11/2019 4:20,,"@blobdell Hi Bryce, sorry to hear that. Could you please DM us more details about your issue? We'll do our best to help you with it. Thanks. -IG"
37,5/4/2019 3:41,,ICYMI: Top stories from April <U+2192> https://t.co/U5tDH1LMQw https://t.co/LV0PUWDnNl
38,5/8/2019 10:28,,@mathewpregasen We understand your frustration. The billing team will look into this as soon as possible. -LH
39,5/10/2019 2:31,,"""To become more efficient, @UPS is partnering with Google Cloud to help sift through massive amounts of data to select the most efficient and cost effective route."" Learn more, via @SDCExec <U+2193>
https://t.co/RaOUmCKkSr"
40,5/3/2019 19:57,,"@kowlgi Hi Sunil, have you discussed this with Community Support? If so, send me the link to your discussion https://t.co/Oj5hWJOeL5. -LC"
41,5/3/2019 23:08,,Meet Patrick Peter. He founded Circunomics and built a big data platform for recycling and remarketing battery components. Get to know Patrick and the other #Circular2030 finalists <U+2192> https://t.co/AruwZqj1UD https://t.co/7sOnwrMsIi
42,5/2/2019 15:28,,"@saraceni_br Hey Rafael, the GCP console is currently experiencing an issue. Updates are available from here https://t.co/8a7lnMRMvI We apologise for any inconvenience caused. -LH"
43,5/2/2019 15:18,,"@bergehurra Hey Berge, thanks for reporting this, the support team is currently looking in to this. We'll update you as soon as we hear back. -LH"
44,5/5/2019 16:12,,Organizing the world's genomic information is easier in the cloud. Try it yourself with a lab <U+2192> https://t.co/EuWMkG3DVZ https://t.co/SNgxAk8Vhi
45,5/9/2019 8:36,,"@johansten Hi Johan, I'm sorry for the confusion there, I should have clarified. The conditions for accepted cards is the same for the Google Cloud Startup program as with Google Cloud payment methods. -GW"
46,5/2/2019 15:24,,@guddukhan1987 @DanBrianWhite The status dashboard has now been updated to reflect this issue. You can check here for updates https://t.co/8a7lnMRMvI The engineering team are working to fix this at the moment. We're sorry for any inconvenience this may ca
47,5/8/2019 4:39,,"@staticillmatic Hi there, thanks for reaching out to us and sorry to hear about your experience. You can reach out to the Google Express team by clicking the 'Contact us' option at https://t.co/7Q8aWQqQce. -CW"
48,5/11/2019 1:10,,"""What we want from technology is a focus on efficiencies in the business, and we saw @GCPcloud as a way to achieve that."" —Jann Krynauw, Director and Actuary, Rezco Asset Management https://t.co/SZZzjIJGIq https://t.co/a2tuXrmZh9"
49,5/6/2019 19:33,,"Our new partnership with ServiceNow's IT Operations Management (ITOM) capabilities allows enterprises to:
<U+2705> improve IT infrastructure management and monitoring
<U+2705> fine-tune the delivery of services
<U+2705> better manage spend across hybrid cloud deployments
https://t.co/dRK5I08nl0 https://t.co/GMAmdRaL0v"
50,5/7/2019 20:01,,"@SPCJG2459_WX Hey Joshua, have you discussed this with Community Support? If so, send me the link to your discussion https://t.co/Oj5hWJOeL5. -JC"
51,5/9/2019 19:33,,"@JoeBlubaugh Thanks for being specific, Joe. I'm sure that's not the way the product's intended to work. Feel free to check https://t.co/3cjTq6obd4 for information on support channels and options according to the account type you work with https://t.co/3c"
52,5/2/2019 15:19,,@jspeis Our GCP Status dashboard has been updated with information of the outage. You can view updates here https://t.co/8a7lnMRMvI We're sorry for any inconvenience this may cause. -LH
53,5/9/2019 7:54,,"@johansten Hi Johan, you're unable to use a prepaid card as this is not an accepted payment method for Google Cloud services. I'm sorry for the inconvenience caused and you can find more information, including further payment options, here: https://t.co/d"
54,5/11/2019 17:57,,"@AaronGreenspan Hey there, have you discussed this with Community Support? If so, send me the link to your discussion https://t.co/Oj5hWJOeL5, make sure you send the link so I can flagged our team.

-JG"
55,5/5/2019 1:09,,It’s a match. Your #Chromebook allows you to swipe right on the things you love with easy touchpad movement between windows. Click below for a quick how-to <U+2193> https://t.co/t55487tgpv
56,5/8/2019 14:15,,IT teams are often looking for guidance on how to better manage extensions in their environment. This is how Google IT manages #Chrome enterprise extensions <U+2192> https://t.co/J5LuTTsDpM #GoogleNext19 https://t.co/hKKczv0feE
57,5/2/2019 18:02,,What drove Cabify to @GCPcloud? More up-to-date data and reduced operational burdens with managed services. Learn more <U+2192> https://t.co/klCSen30iR https://t.co/FXw0wsKCOn
58,5/8/2019 7:16,,@staticillmatic Happy to help! We hope this issue gets resolved for you as soon as possible. -CW
59,5/9/2019 7:10,,"@zIAmMarci Hey Marcel, Severless VPC Access is still in beta testing and as yet we have not made an announcement. Once it is ready for general release we will be able to provide more information. -LH"
60,5/2/2019 15:10,,"@guddukhan1987 Hey Guddu, thanks for letting us know. We've asked the team to look into this and we'll update you when we heard back. -GW"
61,5/5/2019 22:06,,"By working with @MavenWave to move to @gsuite, Sanmina reduced costs, simplified management and improved global collaboration. Check it out <U+2193> 
https://t.co/59BvwwAdud"
62,5/2/2019 15:25,,@kassemshehady @prennaio @jspeis The status dashboard has now been updated to reflect this issue. You can check here for updates https://t.co/8a7lnMRMvI The engineering team are working to fix this at the moment. We're sorry for any inconvenience this may
63,5/11/2019 16:02,,"""The big change for us is the degree of flexibility we now have with Google Compute Engine, it's easy to spin up clusters of different-sized VMs, or custom machine types, depending on our needs."" —Haggai Hofland, CEO, Raycatch https://t.co/v46BVPO2n9 https://t.co/X3IrcgCix2"
64,5/10/2019 4:55,,"@YepLance Hi Jason, can you DM us with more information please? -CA"
65,5/2/2019 15:07,,"@fknfancy Hey there, our support team is looking in to this as the moment. We'll give you an update as soon as we have one. -LH"
66,5/2/2019 14:55,,"@DanBrianWhite Hey Daniel, I've asked the Support Team to look into this. Please DM me a contact email address in case we need to reach out to you. -LH"
67,5/11/2019 10:29,,"@J_Cachero96 Hi there, have you tried using a different zone? This issue might resolve by itself shortly also. Please try again and let us know how you get on. -CW"
68,5/2/2019 14:58,,"@jspeis Hey there, we have asked the support team to look into your report. We hope to have an update soon. -LH"
69,5/8/2019 10:17,,"@mathewpregasen Hy Mathew, which Google Cloud service is this in relation to? -LH"
70,5/6/2019 19:58,,"@achemparathy Hi Arjun, thank you for reaching out. If you have a suggestion for product improvement, feel free to submit a feature request here: https://t.co/vfB8vIylDx. -BI"
71,5/2/2019 15:25,,"@prennaio Hi Paul, you can now learn more about this here: https://t.co/8a7lnMRMvI. thanks again for getting in touch. -GW"
72,5/6/2019 23:07,,"To all the educators that go above and beyond each and every day, happy #TeacherAppreciationWeek. Find out how @GoogleForEdu is working with teachers to help build inclusive classrooms <U+2192> https://t.co/mNO8Kkl7s4 #GoogleEdu https://t.co/Hf6Zt667ge"
73,5/3/2019 14:58,,"@Veidit @bagder Hey John, thanks for the suggestion, have you tried submitting a feature idea on our issue tracker page? https://t.co/UtOSFxL2Bh -LH"
74,5/9/2019 16:12,,"Learn how @SAP on @GCPcloud helps McKesson modernize with patient-centric analytics and lower overhead, via Andrew Zitney, SVP and CTO at @McKesson <U+2192> https://t.co/AjZ72N17ua #SAPPHIRENOW https://t.co/PsIDCQqiC2"
75,5/2/2019 15:13,,"@kassemshehady Hi Kasssem, thanks for saying so! When we know more we'll provide an update. -GW"
76,5/6/2019 16:46,,"@hichaelmart You're welcome to check our direct support options here https://t.co/jnyzNQzncc. Our Status Dashboard has been updated, indicating that an issue related to BigQuery is currently under investigation (in the yellow banner at the bottom) so the "
77,5/7/2019 20:17,,"From 24 hours on-prem to 15 minutes on @GCPcloud, Cloud TPU Pods accelerate @RecursionPharma’s deep learning research while keeping operational costs low <U+2192> https://t.co/a9GdrBvvN7
 #io19 https://t.co/5NtMDtUDEj"
78,5/8/2019 23:07,,"Hats off to our hybrid cloud collaboration with @RedHat. Now, enterprises using Red Hat technologies including #RHEL8 can build a truly hybrid cloud environment that unifies their on-premises and Google Cloud infrastructure <U+2192> https://t.co/bZCtOFl38P https://t.co/cKS3ldmTf1"
79,5/11/2019 10:32,,"@chiragnayyar Hi Chirag, thanks for reaching out to us. Have you tried using a different zone? Keep us posted. -CW"
80,5/9/2019 23:07,,"Introducing Chrome Browser Cloud Management, a central location for admins to view and manage #Chrome Browser policies, settings and installed extensions. Learn more <U+2193> https://t.co/KGHB21Fsmh"
81,5/3/2019 3:11,,"#Circular2030 finalist spotlight: Learn about Goodr, founded by Jasmine Crowe, and its mission to reduce food waste by connecting businesses that have surplus food to people who need meals <U+2192> https://t.co/AruwZqj1UD https://t.co/xphfcwEIxI"
82,5/3/2019 19:17,,Here’s the latest update in Chrome Enterprise and what it means for IT leaders looking for an even easier way to manage across Chrome devices <U+2192> https://t.co/SjtmaeSx7M https://t.co/rzHbCiZByk
83,5/6/2019 17:45,,"With @Apigee's API Management Platform, @Nationwide:
<U+2705> Empowers 1,000+ internal developers to build and share APIs
<U+2705> Evolves development strategy to a product-based model
<U+2705> Drives digital transformation 
https://t.co/TgzZBnAupy https://t.co/piwpMpNT02"
84,5/11/2019 10:50,,"@J_Cachero96 Hi there, have you discussed this with Community Support? If so, send me the link to your discussion https://t.co/Oj5hWJOeL5. -CW"
85,5/8/2019 0:35,,Discover how we're celebrating all the ways developers can take advantage of cloud technologies to build the next generation of mobile and web applications at #io19 <U+2192> https://t.co/KPQ9SBMk89 https://t.co/KnTdJje60r
86,5/10/2019 20:34,,"Did you know that the unemployment rate for military spouses is at least 4x the national average? New functionality from Cloud Talent Solution helps the #milspouse community find remote work opportunities on your career site <U+2193> #GrowWithGoogle
https://t.co/ZGX6JVKSNG"
87,5/7/2019 22:36,,Protection against security breaches fits in your pocket. Android phone’s built-in security key is now generally available. Learn more <U+2192> https://t.co/9OKAAfpcws https://t.co/sD2DiR6QRe
88,5/6/2019 16:36,,"@hichaelmart Hey Michael, thanks for letting us know.  Have you had the chance to discuss the symptoms with our Community at https://t.co/Oj5hWJOeL5? If so, send me the link to your discussion. -EC"
89,5/11/2019 10:57,,"@chiragnayyar Great! Happy to hear, Chirag. Have a great day. -CW"
90,5/8/2019 5:36,,"@staticillmatic Hi there, thanks for getting back to us. Have you tried calling the Returns line? For more details, check here: https://t.co/Wr9BHirFLj. -CW"
91,5/3/2019 15:02,,@Veidit @bagder We're glad to hear that. We're always looking for ways to improve our service and the issue tracker is a great way for you to make suggestions to us. -LH
92,5/2/2019 15:08,,"@prennaio Hi Paul, thanks for letting us know. We've asked the Support Team to look into this, and we'll update you when we know more. -GW"
93,5/4/2019 20:04,,"Some in-flight entertainment: Learn how Amadeus and Google Cloud are transforming travel technology platforms together <U+2193>
https://t.co/9WoaFaOhWn"
94,5/10/2019 13:02,,"@YepLance Hi there Jason, I'm sorry to hear about this delay. I'd recommend reaching out to billing support with the steps in this article so that they can look into this further: https://t.co/5J1bHQWaU6 -GW"
95,5/7/2019 19:59,,"We’re launching #KotlinEverywhere - a global series of community-led events - supported by @googledevs and @JetBrains - where you can learn more about #kotlin, including using it in #Android, #GCP and #multiplatform development. Find out more at https://t.co/s11wpDeaNP https://t.co/FpxjCLAD1Q"
96,5/12/2019 5:46,"Amravati, India",#GoogleCloud #AutoML Natural Language helping to build Text Classification Model w/o much #deeplearning experience @smartDataIncLtd
97,5/3/2019 9:40,Sri Lanka,"Introduction to #Serverless via @DZone #cloud #guide by @asankha 

<U+0001F517> https://t.co/yDbCMn8NmQ 

#CloudComputing #CloudNative #AWS #GCP #Azure #OpenWhisk #FaaS #Java #Javascript #Nodejs #Python #rstats #BigData #DataScientists #AI @ThinkServerless @SLAppForge @nodejs @awscloud"
98,5/3/2019 8:20,Sri Lanka,"Top 4 Innovations in #Containers and #Cloud Computing 
<U+0001F449> https://t.co/8RQZTu0Wj5 

#CloudComputing #CloudNative #AWS #GCP #Azure #OpenWhisk #FaaS #Java #Javascript #Nodejs #Python #rstats #BigData #DataScientists #AI #Kubernetes #bitcoin #crypto"
99,5/3/2019 12:30,Sri Lanka,"Comparing #Serverless Architecture Providers: #AWS, #Azure, Google, #IBM, and Other #FaaS Vendors 

 <U+0001F449> https://t.co/bQz7VJ6Q0O 

#CloudComputing #CloudNative #GCP #OpenWhisk #Java #Javascript #Nodejs #Python #rstats #BigData #DataScientists #AI @ThinkServerless @SLAppForge"
100,5/8/2019 13:25,Sri Lanka,"Serverless Webhook? Deploy Yours in 5 Minutes – or Less!

<U+0001F449>https://t.co/M2h1RSQUyR

#CloudComputing #CloudNative #AWS #GCP #FaaS #Java #Javascript #Nodejs #Python #rstats #BigData #DataScientists @ThinkServerless @SigmaIDE"
101,5/9/2019 11:20,Sri Lanka,"Gain full observability of your #AWS functions 
<U+0001F449> https://t.co/CgTRqkDbyC 

#CloudComputing #CloudNative #AWS #GCP #FaaS #Java #Javascript #Nodejs #Python #rstats #BigData #DataScientists https://t.co/JOiIJAFfGH"
102,5/8/2019 12:40,Sri Lanka,"Try next-generation #serverless application developer #toolkit for enterprise-grade #CloudComputing requirements
<U+0001F517>
https://t.co/Q4fcs8hBcz

#CloudComputing #CloudNative #AWS #GCP #FaaS #Java #Javascript #Nodejs #Python #rstats #BigData #DataScientists @ThinkServerless @SigmaIDE"
103,5/6/2019 9:25,Sri Lanka,"How, and When, to Deploy #Serverless 
<U+0001F517>
https://t.co/7ZUcdeEjwo

#CloudComputing #CloudNative #AWS #GCP #Azure #OpenWhisk #FaaS #Java #Javascript #Nodejs #Python #rstats #BigData #DataScientists @ThinkServerless @SLAppForge @thenewstack"
104,5/12/2019 5:40,Sri Lanka,"Serverless Revolution: the Good, the Bad and the Ugly 
<U+0001F447> 
https://t.co/nHLIH85NX9

#CloudComputing #CloudNative #AWS #GCP #Azure #OpenWhisk #FaaS #Java #Javascript #Nodejs #Python #rstats #BigData #DataScientists"
105,5/6/2019 5:31,"Columbia, SC",American Cancer Society uses #Google #Cloud machine learning to power cancer research https://t.co/GCaAIFM8QK #googlecloud
106,5/10/2019 5:05,"Columbia, SC",Announcing the winners of the Confidential Computing Challenge https://t.co/nqZ1S1suU6 #cloud #google #googlecloud
107,5/9/2019 5:51,"Columbia, SC",From the data warehouse: Urs H<U+04E7>lzle explains how data analytics and ML can transform your business https://t.co/386RnLxHXH #cloud #google #googlecloud
108,5/4/2019 5:46,"Columbia, SC",Connecting employers near and far to remote job seekers with #Cloud Talent Solution https://t.co/bLNiP65gIj #google #googlecloud
109,5/12/2019 5:29,"Columbia, SC",Improving data quality for machine learning and analytics with #Cloud Dataprep https://t.co/GWAiQZRYU0 #google #googlecloud
110,5/5/2019 5:43,"Columbia, SC",Containing our enthusiasm: All the Kubernetes security news from #Google #Cloud Next ‘19 https://t.co/gkdNZoAqUs #googlecloud
111,5/3/2019 5:43,"Columbia, SC",AI in depth: Creating preprocessing-model serving affinity with custom online prediction on AI Platform Serving https://t.co/IhHa1tejS0 #cloud #google #googlecloud
112,5/8/2019 5:52,"Columbia, SC",#Google #Cloud networking in depth: Simplify routing between your VPCs with VPC peering https://t.co/NTbux93hrw #googlecloud
113,5/7/2019 5:31,"Columbia, SC",AI in Depth: Serving a PyTorch text classifier on AI Platform Serving using custom online prediction https://t.co/Jv1r0BHls5 #cloud #google #googlecloud
114,5/11/2019 5:28,"Columbia, SC",Last month today: April on GCP https://t.co/xktKg070cO #cloud #google #googlecloud
115,5/12/2019 5:28,Dubai,"No Defeat is Final until you stop trying! https://t.co/S29NcAhr2l
#sundaymotivation #thoughtfortheday #inspiration #innovation # #cloudbased #customersuccess #contactcenter #startup #googlecloud #totd #ziwo #thoughtsofeveryday #integration #SME #B2B #B2C #API #CRM #callcenter https://t.co/5znjihHCai"
116,5/12/2019 5:16,Bay Area,Deploy an Elastic Web App with #Portworx and #GoogleCloud Run  https://t.co/mP8U6Iu5CP
117,5/8/2019 16:55,"Mumbai, India","If you have missed out on catching up on #IO19 ... here’s a quick read on the “#Cloud” #announcements

- #Android Security
- #CloudTPU
- #Maps platform
- #Firebase 

https://t.co/2Ysis7OEcX

@GoogleCloud_IN @googlecloud"
118,5/12/2019 4:57,"Mumbai, India","@gcdcIndore kick starts #NextExtended with major announcements from #googlecloud

@GoogleDevsIN @GoogleCloud_IN https://t.co/ycQX8r1XcV"
119,5/8/2019 7:23,"Seattle, WA","Monetizing IIoT - real-life use cases
in the manufacturing space

#IoT and the #cloud are naturals together.

@IIoT_World #googlecloud #aws #azure 

https://t.co/Lj5FbpPBof"
120,5/11/2019 17:53,"Seattle, WA","I just noticed this morning that Google Cloud Run supports IPv6 and HTTP/2 without requiring any work on my part. Good job Google Cloud.

#googlecloud #cloudrun #gcp #serverless #containers"
